{
  "id": "touhouqa-test-v1",
  "name": "TouhouQA Test v1",
  "description": "Full page-level test split before Core filtering. Secondary track for coverage comparison.",
  "language": "zh",
  "primary_metric": "accuracy",
  "question_count": 3434,
  "split": "test",
  "subset": "full",
  "status": "active",
  "artifacts": {
    "questions_public": null,
    "questions_sha256": null,
    "gold_private": "maintainer-only/test.jsonl",
    "gold_sha256": null,
    "manifest": "output/splits/split_manifest.json"
  },
  "grading": {
    "method": "exact_match",
    "module": "touhouqa.grading",
    "normalize": ["NFKC", "ws_fold", "trailing_punct_strip", "casefold"]
  },
  "created_at": "2026-05-19",
  "deprecated_at": null,
  "superseded_by": null
}
